{
  "$schema": "http://json-schema.org/draft-07/schema",
  "type": "object",
  "properties": {
    "$schema": {
      "description": "A reference to this schema",
      "type": "string",
      "enum": [
        "https://raw.githubusercontent.com/MaayanLab/appyter-catalog/master/schema/appyter-validator.json"
      ]
    },
    "name": {
      "description": "Slug name of this appyter (same as directory, used as url location)",
      "type": "string",
      "pattern": "^[a-zA-Z][a-zA-Z0-9_]*$"
    },
    "title": {
      "description": "Appyter title",
      "type": "string"
    },
    "version": {
      "description": "Semver version",
      "type": "string",
      "format": "regex",
      "pattern": "^[0-9]+\\.[0-9]+\\.[0-9]+$"
    },
    "description": {
      "description": "A short description of the appyter",
      "type": "string",
      "maxLength": 150
    },
    "authors": {
      "description": "A list of authors who contributed to the appyter",
      "type": "array",
      "items": {
        "type": "object",
        "properties": {
          "name": {
            "description": "The name of the author",
            "type": "string"
          },
          "email": {
            "description": "The email of the author",
            "type": "string",
            "format": "email"
          }
        }
      }
    },
    "image": {
      "description": "A relative path (preferred) or url to a thumbnail for the appyter. Size: 1280x720",
      "type": "string"
    },
    "url": {
      "description": "A url to the source code or website of the appyter",
      "type": "string",
      "format": "url"
    },
    "tags": {
      "description": "A set of tags describing the appyter",
      "type": "array",
      "items": {
        "type": "string"
      }
    },
    "license": {
      "description": "A license identified by https://spdx.org/licenses/",
      "type": "string"
    },
    "public": {
      "description": "Whether or not this should be visible on the catalog (defaults to true)",
      "type": "boolean"
    },
    "appyter": {
      "description": "Appyter information and configuration",
      "type": "object",
      "properties": {
        "file": {
          "description": "The appyter file relative to this directory",
          "type": "string"
        },
        "profile": {
          "description": "The pre-made profile to base the appyter off of",
          "type": "string"
        },
        "extras": {
          "description": "Any extras to enable in your appyter",
          "type": "array",
          "items": {
            "type": "string"
          }
        }
      },
      "required": [
        "file"
      ]
    }
  },
  "required": [
    "$schema",
    "name",
    "title",
    "version",
    "description",
    "authors",
    "license",
    "appyter"
  ]
}