{
  "$schema": "https://raw.githubusercontent.com/MaayanLab/appyter-catalog/master/schema/appyter-validator.json",
  "name": "PHGKB_Harmonizome_ETL",
  "title": "Harmonizome ETL: Public Health Genomics and Precision Health Knowledge Base",
  "version": "0.1.2",
  "description": "An appyter to process data from the Public Health Genomics and Precision Health Knowledge Base for the Harmonizome.",
  "image": "ETL_Logo.png",
  "authors": [
    {
      "name": "Charles R. Dai",
      "email": "charles.r.dai@gmail.com"
    }
  ],
  "url": "https://github.com/MaayanLab/Harmonizome-Data-Processing-Appyters",
  "tags": [
    "Harmonizome",
    "Harmonizome ETL Script",
    "PHGKB"
  ],
  "license": "MIT",
  "appyter": {
    "file": "PHGKB.ipynb",
    "profile": "biojupies"
  }
}

