{
  "$schema": "https://raw.githubusercontent.com/MaayanLab/appyter-catalog/master/schema/appyter-validator.json",
  "name": "STITCH_Drugmonizome_ETL",
  "title": "Drugmonizome ETL: STITCH",
  "version": "0.0.2",
  "description": "An appyter to process drug-protein associations from STITCH.",
  "image": "Drugmonizome_ETL.png",
  "authors": [
    {
      "name": "Eryk Kropiwnicki",
      "email": "eryk.kropiwnicki@icahn.mssm.edu"
    }
  ],
  "url": "https://github.com/MaayanLab/Drugmonizome-Data-Processing-Appyters",
  "tags": [
    "Drugmonizome",
    "ETL Script",
    "STITCH"
  ],
  "license": "MIT",
  "appyter": {
    "file": "STITCH.ipynb",
    "profile": "biojupies"
  }
}