{
    "$schema": "https://raw.githubusercontent.com/MaayanLab/appyter-catalog/master/schema/appyter-validator.json",
    "name":"Gene-Age-Trends-Appyter",
    "title": "Gene Expression vs Age Plot Generator",
    "version": "0.0.1",
    "description": "An appyter that creates bar charts to visualize KINOMEscan and TAS vectors data from HMS LINCS.",
    "authors": [
      {
        "name": "Tahmid Ahamed",
        "email": "ahamedt@wharton.upenn.edu"
      }
    ],
    "url": "https://github.com/MaayanLab/appyter-catalog",
    "tags": [
      "Gene Expression, Age, Mouse,Human"
    ],
    "license": "Apache-2.0",
    "appyter": {
      "file": "Age_Gene_Appyter.ipynb",
      "profile": "biojupies"
    }
  }