{
  "$schema": "https://raw.githubusercontent.com/MaayanLab/appyter-catalog/master/schema/appyter-validator.json",
  "name": "Roadmap_Epigenomics_Harmonizome_ETL",
  "title": "Harmonizome ETL: Roadmap Epigenomics",
  "version": "0.1.2",
  "description": "An appyter to process data from the Roadmap Epigenomics Project for the Harmonizome.",
  "image": "ETL_Logo.png",
  "authors": [
    {
      "name": "Charles R. Dai",
      "email": "charles.r.dai@gmail.com"
    }
  ],
  "url": "https://github.com/MaayanLab/Harmonizome-Data-Processing-Appyters",
  "tags": [
    "Roadmap Epigenomics",
    "Harmonizome",
    "ETL Script"
  ],
  "license": "CC-BY-NC-SA-4.0",
  "appyter": {
    "file": "Roadmap Epigenomics.ipynb",
    "profile": "biojupies"
  }
}