{
  "$schema": "https://raw.githubusercontent.com/MaayanLab/appyter-catalog/master/schema/appyter-validator.json",
  "name": "CTD_Disease_Harmonizome_ETL",
  "title": "CTD (Disease) Harmonizome ETL",
  "version": "0.0.1",
  "description": "A Data Processor for the Comparative Toxicogenomics Database",
  "authors": [
    {
      "name": "Charles R. Dai",
      "email": "charles.r.dai@gmail.com"
    }
  ],
  "url": "https://github.com/MaayanLab/Harmonizome-Data-Processing-Appyters",
  "tags": [
    "Harmonizome",
    "Harmonizome ETL Script",
    "CTD",
    "Comparative Tosicogenomics Database"
  ],
  "license": "MIT",
  "appyter": {
    "file": "CTD (Disease).ipynb",
    "profile": "biojupies"
  }
}
