{
    "$schema": "https://raw.githubusercontent.com/MaayanLab/appyter-catalog/master/schema/appyter-validator.json",
    "name": "Gene_Expression_T2D_Signatures",
    "title": "My Gene's Expression in T2D Transcriptomics Signatures",
    "version": "0.0.4",
    "description": "An appyter that generates volcano plots for visualizing gene-specific expression in Type 2 Diabetes signatures.",
    "image": "example_plot.png",
    "authors": [
      {
        "name": "Sherry Xie",
        "email": "sxie04@gmail.com"
      },
      {
        "name": "Alex Lachmann",
        "email": "alexander.lachmann@mssm.edu"
      },
      {
        "name": "Kathleen Jagodnik",
        "email": "kmjagodnik@gmail.com"
      },
      {
        "name": "Mark Keller",
        "email": "mark.keller@wisc.edu"
      }
    ],
    "url": "https://github.com/MaayanLab/appyter-catalog/tree/master/appyters/Gene_Expression_T2D_Signatures",
    "tags": [
      "Type 2 Diabetes",
      "T2D",
      "Signatures",
      "Transcriptomics",
      "Volcano Plot",
      "Visualization"
    ],
    "license": "CC-BY-NC-SA-4.0",
    "appyter": {
      "file": "Gene_Expression_T2D_Signatures.ipynb",
      "profile": "biojupies",
      "extras": [
        "hide-code",
        "toggle-code"
      ]
    }
  }
  