{
  "$schema": "https://raw.githubusercontent.com/MaayanLab/appyter-catalog/master/schema/appyter-validator.json",
  "name": "PrismEXP",
  "title": "PrismEXP Appyter",
  "version": "0.0.5",
  "description": "An appyter that calulates gene function prediction for arbitrary gene set libraries using the PrismEXP algorithm and a pretrained model.",
  "image": "featured-image.png",
  "authors": [
    {
      "name": "Alexander Lachmann",
      "email": "alexander.lachmann@mssm.edu"
    }
  ],
  "url": "https://github.com/MaayanLab/appyter-catalog",
  "tags": [
    "Machine Learning",
    "Enrichr",
    "Geneshot",
    "RNA-seq"
  ],
  "license": "CC-BY-NC-SA-4.0",
  "appyter": {
    "file": "PrismEXP.ipynb",
    "profile": "biojupies",
    "extras": [
      "toc",
      "toggle-code"
    ]
  }
}