{
  "$schema": "https://raw.githubusercontent.com/MaayanLab/appyter-catalog/master/schema/appyter-validator.json",
  "name": "tcgaDataLoader",
  "title": "tcgaDataLoader",
  "version": "0.0.1",
  "description": "An appyter that loads RNA-seq and clinical data tables from The Cancer Genome Atlas (TCGA) based on desired search parameters for further analysis.",
  "authors": [
    {
      "name": "Nicole Moiseyev",
      "email": "nicole.moiseyev@duke.edu"
    }
  ],
  "url": "https://github.com/MaayanLab/appyter-catalog",
  "tags": ["Databases", "TCGA"],
  "license": "MIT",
  "appyter": {
    "file": "tcgaDataLoader.ipynb",
    "profile": "biojupies"
  }
}
