{
  "$schema": "https://raw.githubusercontent.com/MaayanLab/appyter-catalog/master/schema/appyter-validator.json",
  "name": "Enrichr_Scatterplot_Appyter",
  "title": "Enrichr Scatterplot Appyter",
  "version": "0.0.6",
  "description": "An appyter that displays enrichment analysis results on a scatterplot of gene sets from an Enrichr library clustered by similarity.",
  "image": "featured-image.png",
  "authors": [
    {
      "name": "Skylar Litz",
      "email": "litzskylar@gmail.com"
    }
  ],
  "url": "https://github.com/MaayanLab/appyter-catalog",
  "tags": [
    "Enrichr",
    "Enrichment Analysis"
  ],
  "license": "CC-BY-NC-SA-4.0",
  "appyter": {
    "file": "Scatter-Appyter.ipynb",
    "profile": "biojupies",
    "extras": [
      "toc",
      "toggle-code"
    ]
  }
}