{
  "$schema": "https://raw.githubusercontent.com/MaayanLab/appyter-catalog/master/schema/appyter-validator.json",
  "name": "ChEA3_Appyter",
  "title": "ChEA3 Appyter",
  "version": "0.0.1",
  "description": "ChIP-X Enrichment Analysis 3 Appyter",
  "image": "chea3_appyter_logo.png",
  "authors": [
    {
      "name": "Alex Tsai",
      "email": "atsai3720@gmail.com"
    }
  ],
  "url": "https://github.com/MaayanLab/appyter-catalog",
  "tags": [
    "ChEA3",
    "Enrichment Analysis"
  ],
  "license": "CC-BY-NC-SA-4.0",
  "public": true,
  "appyter": {
    "file": "ChEA3_Appyter.ipynb",
    "profile": "biojupies",
    "extras": [
      "toc",
      "hide-code",
      "toggle-code"
    ]
  }
}
