{
  "$schema": "https://raw.githubusercontent.com/MaayanLab/appyter-catalog/master/schema/appyter-validator.json",
  "name": "SC_RNA_seq",
  "title": "Single cell RNA-seq analysis pipeline",
  "version": "0.0.6",
  "description": "scRNA-seq analysis pipeline enables users to analyze and visualize scRNA-seq datasets with state-of-the-art algorithms and visualization methods.",
  "image": "screenshot.png",
  "authors": [
    {
      "name": "Minji Jeon",
      "email": "minji.jeon1@gmail.com"
    }
  ],
  "url": "https://github.com/MaayanLab/appyter-catalog",
  "tags": [
    "RNA-seq",
    "scRNA-seq"
  ],
  "license": "Apache-2.0",
  "appyter": {
    "file": "Single_cell_RNA_seq_Analysis_Pipeline.ipynb",
    "profile": "biojupies"
  }
}